file_name,uni,wylie,url,dept,grade,char_len,audio_len,path,inf
STT_NS_M0028_0377_2835885_to_2839260,ལུས་རྩལ་ཡེ་མ་རྩེ་ཉོབ་རེ་བསྡད་བསྡད་ཡ་གཅིག་ཡོད་བ་ཉལ་ས་སྒང་ལ།  ,lus rtsal ye ma rtse nyob re bsdad bsdad ya gcig yod ba nyal sa sgang la/__,https://d38pmlk0v88drf.cloudfront.net/wav16k/STT_NS_M0028_0377_2835885_to_2839260.wav,STT_NS,3,60,3.375,wav16k/STT_NS_M0028_0377_2835885_to_2839260.wav,ལུས་རྩལ་ཡེ་མ་རྩེས། ཨེ་ནས་ཉོབ་རེ་བསྡད་བསྡད་ཡ་ཅིག་ཡོད་བ་ཉལ་ས་ཁང་།
STT_NS_M0028_0378_2839480_to_2844914,འདི་འདྲའི་ཡག་པོ་མ་རེད་ཡོད་བ། ངས་ལུས་རྩལ་རྩེ་ལབ་ན་ཞེ་བོ་གཅིག་ཁྱེད་རང་ཚོ། ཨ། མཆོངས་རྒྱག་རྒྱག་ཨེ་འདྲའི་ཡིན་ཅིག་མིན་ཅིག ,'di 'dra'i yag po ma red yod ba/_ngas lus rtsal rtse lab na zhe bo gcig khyed rang tsho/_a/_mchongs rgyag rgyag e 'dra'i yin cig min cig_,https://d38pmlk0v88drf.cloudfront.net/wav16k/STT_NS_M0028_0378_2839480_to_2844914.wav,STT_NS,3,116,5.434,wav16k/STT_NS_M0028_0378_2839480_to_2844914.wav,དེ་འདྲའི་ཡག་པོ་མ་རེད་ཡོད་བ། ངའི་ལུས་རྩལ་རྩེ་ལང་ན་ཞེ་བོ་གཅིག་ཁྱེད་རང་ཚོ་ཆོང་རྒྱག་བརྒྱབ་ཨེ་འདྲའི་ཡིན་གཅིག་མིན་གཅིག་ལུས་རྩལ།
STT_NS_M0028_0382_2864269_to_2870209,གཞས་བཏང་རཱ། གཞས་སྐད་ཆེན་པོ། གཞས་ཡང་སྐད་ཆེན་པོ་ཞེ་བོ་ཨེ་འདྲའི་བཏང་། མི་ཚང་མ་གནོད་བསྐྱལ་ཡ་འདི་འདྲ་མིན་པ་ཡོད་བ།  ,gzhas btang rA/_gzhas skad chen po/_gzhas yang skad chen po zhe bo e 'dra'i btang /_mi tshang ma gnod bskyal ya 'di 'dra min pa yod ba/__,https://d38pmlk0v88drf.cloudfront.net/wav16k/STT_NS_M0028_0382_2864269_to_2870209.wav,STT_NS,3,110,5.94,wav16k/STT_NS_M0028_0382_2864269_to_2870209.wav,གཞས་བཏང་རཱ། གཞས་སྐད་ཆེན་པོ། གཞས་ཡང་སྐད་ཆེན་པོ་ཞེ་བོ་བཏང་ན་མི་ཚང་མ་གནོད་སྐྱེལ་ཡ་ཨེ་འདྲའི་མིན་པ་ཡོད་བ།
STT_NS_M0028_0383_2870209_to_2876149,གཞས་སོ་སོ་གོ་སི་བཏང་རཱ། ཨེ་ནས་རོགས་པ་མཉམ་དུ་གཞས་འཁྲབ་འདྲ་བོ་བྱས་ན་ག་འདྲའི་སྐྱིད་བོ་ཡོད་རེད་མ་རེད་བེ།  ,gzhas so so go si btang rA/_e nas rogs pa mnyam du gzhas 'khrab 'dra bo byas na ga 'dra'i skyid bo yod red ma red be/__,https://d38pmlk0v88drf.cloudfront.net/wav16k/STT_NS_M0028_0383_2870209_to_2876149.wav,STT_NS,3,102,5.94,wav16k/STT_NS_M0028_0383_2870209_to_2876149.wav,གཞས་སོ་སོ་གོ་སོང་བཏང་རེད། ཨེ་ནས་རོགས་པ་མཉམ་དུ་གཞས་འཁྲབ་འདྲ་བོ་བྱས་ན་ག་འདྲའི་སྐྱིད་པོ་ཡོད་རེད་མ་རེད་བེ།
STT_NS_M0028_0385_2883507_to_2892940,ད་རྦད་དེ་ཁོ་རང་ག་རེ་ལབ་ཀི་རེད། མི་གསར་བ་འདྲ་བོ་ཚོར་ཡ་ཅིག་ཡོད་བ། གཞན་པ་ཉར་རེ་ཉོབ་རེ་བསྡད་བསྡད་ན་ེད་ཡོད་བ། འཛིན་གྲྭ་ནང་འགྲོ་ཡ་ཀ་ཅི་ད། འགྲོ་ཡ་ཁོ་རང་ཉོབ་ཀི་རེད་ད་སོ་སོ། ཉོབ་ཏོ་ཚ་དྲགས་ནས།  ,da rbad de kho rang ga re lab ki red/_mi gsar ba 'dra bo tshor ya cig yod ba/_gzhan pa nyar re nyob re bsdad bsdad na \u0f7ada yod ba/_'dzin grwa nang 'gro ya ka ci da/_'gro ya kho rang nyob ki red da so so/_nyob to tsha drags nas/__,https://d38pmlk0v88drf.cloudfront.net/wav16k/STT_NS_M0028_0385_2883507_to_2892940.wav,STT_NS,3,184,9.433,wav16k/STT_NS_M0028_0385_2883507_to_2892940.wav,ད་རྦད་དེ་ཁོ་རང་ག་རེ་ལབ་དཀི་རེད། མི་གསར་བ་འདྲ་བོ་ཚོར་ཡ་ཅིག་ཡོད་བ། གཞན་པ་ཉར་ཡ་ཉོབ་ཡ་བསྡད་བསྡད་ན་ད་ཡོད་བ། འཛིན་གྲྭ་ནང་འགྲོ་ཡ་ཀ་ཅི་ད་འགྲོ་ཡ་ཁོ་རང་ཉོབ་ཀྱི་རེད་ད། སོ་སོ་ཉོབ་ཏོ་ཚ་དྲགས་ནས།
STT_NS_M0028_0387_2900162_to_2908920,མ་རེད་བས། སོ་སོ་ཤེས་ཡོན་རག་ཡ་ལ། ཤེས་བྱ་ཡོན་ཏན་རག་ཡ་ལ་ཡོད་བ། འདི་འདྲའི་ཉོབ་ཏུ་བྱས་བ་ཡིན་ན། ད་ཡོད་བ་སོ་སོ་སྡུག་གྱོད་རང་རེད་ཡོད་བ། ཕ་མ་ནི་འདི་ལ་རྟག་པར་ད། མཐོང་གི་ཡོད་མ་རེད་བ། པུ་གུ ,ma red bas/_so so shes yon rag ya la/_shes bya yon tan rag ya la yod ba/_'di 'dra'i nyob tu byas ba yin na/_da yod ba so so sdug gyod rang red yod ba/_pha ma ni 'di la rtag par da/_mthong gi yod ma red ba/_pu gu_,https://d38pmlk0v88drf.cloudfront.net/wav16k/STT_NS_M0028_0387_2900162_to_2908920.wav,STT_NS,3,178,8.758,wav16k/STT_NS_M0028_0387_2900162_to_2908920.wav,མ་རེད་བེ། སོ་སོ་ཤེས་ཡོན་རག་ཡ་ལ་ཤེས་བྱ་ཡོན་ཏན་རག་ཡ་ལ་ཡོད་བ། དེ་འདྲའི་ཉོབ་ཏོ་བྱས་པ་ཡིན་ན་ད་ཡོད་བ་སོ་སོ་སྡུག་གྱོང་རང་རེད་ཡོད་བ། ཕ་མ་ནི་འདི་ལ་རྟག་པར་ད་མཐོང་གི་ཡོད་མ་རེད། བུ་གུ་ག་ར
STT_NS_M0028_0389_2918033_to_2925407,ད་ལྟ་འདི་ལ་ཡོད་མ་རེད་བ། ང་ཚོ་ལྷོ་ཕྱོགས་ལ་ཡོད་དུས་ཙམ་པ་ལ་ཕ་མ་ཡོད་རེད་བ་རྦད་དེ་ཁོ་རང་ཐག་རིང་པོ་ཡོད་དུས། ཕ་མ་ང་ཚོ་ག་རེ་བྱས་ནས་དངོས་གནས་བྱས་ན་འགྲིག་གི་ཡོད་རེད།  ,da lta 'di la yod ma red ba/_nga tsho lho phyogs la yod dus tsam pa la pha ma yod red ba rbad de kho rang thag ring po yod dus/_pha ma nga tsho ga re byas nas dngos gnas byas na 'grig gi yod red/__,https://d38pmlk0v88drf.cloudfront.net/wav16k/STT_NS_M0028_0389_2918033_to_2925407.wav,STT_NS,3,157,7.374,wav16k/STT_NS_M0028_0389_2918033_to_2925407.wav,ད་ལྟ་འདི་ལ་ཡོད་མ་རཱེ། ང་ཚོ་ལྷོ་ཕྱོགས་ལ་ཡོད་དུས་ཙམ་པ་ལ་ཕ་མ་ཡོད་རཱ། རྦད་དེ་ཁོ་རང་ཐག་རིང་པོ་ཡོད་དུས། ཕ་མ་ང་ཚོ་ག་རེ་བྱས་ནས་དངོས་གནས་བྱས་ན་འགྲིག་གི་ཡོད་རེད།
STT_NS_M0028_0384_2876318_to_2880807,གཞས་འདྲ་བོ་འཁྲབ། ཨེ་ནས་སོ་སོ་གཟུགས་པོ་ལས་ལུས་རྩལ་ཆགས། སེམས་པ་ཡང་སྐྱོད་བོ་ཡོད་བ། རྗེས་མ།  ,gzhas 'dra bo 'khrab/_e nas so so gzugs po las lus rtsal chags/_sems pa yang skyod bo yod ba/_rjes ma/__,https://d38pmlk0v88drf.cloudfront.net/wav16k/STT_NS_M0028_0384_2876318_to_2880807.wav,STT_NS,3,89,4.489,wav16k/STT_NS_M0028_0384_2876318_to_2880807.wav,གཞས་འདྲ་བོ་འཁྲབ། ཨེ་ནས་སོ་སོའ་གཟུགས་པོ་ལ་ལུས་རྩལ་ཆགས། སེམས་པ་ཡང་སྐྱིད་པོ་ཡོད་བ། ཨེ་ནས་རྗེས་མ།
STT_NS_M0028_0386_2893429_to_2895876,ད་ང་དེ་རིང་འཛིན་གྲྭ་འགྲོ་ཡ་ཉོབ་ཀི་འདུག་ལབ་རེད་བ། བསྡད་ཀི་རེད་བ།  ,da nga de ring 'dzin grwa 'gro ya nyob ki 'dug lab red ba/_bsdad ki red ba/__,https://d38pmlk0v88drf.cloudfront.net/wav16k/STT_NS_M0028_0386_2893429_to_2895876.wav,STT_NS,3,65,2.447,wav16k/STT_NS_M0028_0386_2893429_to_2895876.wav,ད་ང་དེ་རིང་འཛིན་གྲྭ་འགྲོ་ཡ་ཉོབ་ཀི་འདུག་ལབ་རེད། བསྡད་ཀི་རཱ།
STT_NS_M0028_0388_2908920_to_2917679,ག་རེ་བྱེད་ཀི་ཡོད་བ། པུ་གུ་ག་རེ་བྱེད་བྱེད་རེད་བ། བསམ་བློ་བཏང་ན་ད། པུ་གུ་འདི་སོ་སོ་འགན་འཁྱེར་ཐུབ་ཀི་འདུག་མི་འདུག་བལྟ་ཡི་ཡོད་རེད་ད། ད་ལྟ་འདི་མཐོ་སློབ་འདི་གིས་ཡོད་བ། ག་རེ་བྱས་ལབ་ན་ང་ཚོ་འདྲ་བོ་ཡིན་ན་ད་ཡོད་བ། ཕ་མ།  ,ga re byed ki yod ba/_pu gu ga re byed byed red ba/_bsam blo btang na da/_pu gu 'di so so 'gan 'khyer thub ki 'dug mi 'dug blta yi yod red da/_da lta 'di mtho slob 'di gis yod ba/_ga re byas lab na nga tsho 'dra bo yin na da yod ba/_pha ma/__,https://d38pmlk0v88drf.cloudfront.net/wav16k/STT_NS_M0028_0388_2908920_to_2917679.wav,STT_NS,3,209,8.759,wav16k/STT_NS_M0028_0388_2908920_to_2917679.wav,བྱེད་ཀི་ཡོད་བ། བུ་གུ་ག་རེ་བྱེད་བྱེད་རཱ་བསམ་བློ་བཏང་ན་ད། བུ་གུ་དེ་སོ་སོས་འགན་འཁྱེར་ཐུབ་ཀི་འདུག་མི་འདུག་ལྟ་གི་ཡོད་རེད་ད། ད་ལྟ་འདི་མཐོ་སློབ་འདི་གིས་ཡོད་བ། ག་རེ་བྱས་ནས་ལབ་ན་ང་ཚོ་འདྲ་བོ་ཡིན་ན་ད་ཡོད་བ་ཕ་མ།
STT_NS_M0028_0390_2925728_to_2933018,འཛིན་གྲྭ་མ་སླེབས་ཉལ་བསྡད་ནས། ག་རེད་ལབ་མྱི་འདྲ་བོ་ཡོད་མ་རེད། ཇུས་གཏོགས་བྱེད་མྱི་ཁོ་རང་ཡོད་མ་རེད་ང་ཚོ་ལ་ད་ཡོད་བ། ཡ་བྱེད་མྱི་ཁོ་རང་ཡོད་མ་རེད། དྲང་པོ་བཤད་ན། རོགས་པ་ཡེ་ནི་ད་སོ་སོ་སོ་སོ་འགྲོ་འགྲོ་ཡི་རེད།  ,'dzin grwa ma slebs nyal bsdad nas/_ga red lab myi 'dra bo yod ma red/_jus gtogs byed myi kho rang yod ma red nga tsho la da yod ba/_ya byed myi kho rang yod ma red/_drang po bshad na/_rogs pa ye ni da so so so so 'gro 'gro yi red/__,https://d38pmlk0v88drf.cloudfront.net/wav16k/STT_NS_M0028_0390_2925728_to_2933018.wav,STT_NS,3,199,7.29,wav16k/STT_NS_M0028_0390_2925728_to_2933018.wav,འཛིན་གྲྭ་མ་སླེབས་ཉལ་བསྡད་ནས་ག་ལབ་མྱི་འདྲ་བོ་ཡོད་མ་རེད། ཇུས་གཏོགས་བྱེད་མྱི་ཁོ་རང་ཡོད་མ་རེད། ང་ཚོ་ལ་ད་ཡོད་བ། ཡ་བྱེད་མྱི་ཁོ་རང་ཡོད་མ་རེད་ དྲང་པོ་བཤད་ན། རོགས་པ་ནི་ད་སོ་སོ་སོ་འགྲོ་འགྲོ་གི་རེ།
STT_NS_M0028_0391_2933018_to_2940308,རེད་བ་ཡོད་བ། ཡ་བྱེད་མྱི་མེད་བ་སོ་སོ་ལ། ཡ་བྱེད་མྱི་མེད་ན་ཨེ་ནས་སོ་སོ་ག་རེ་བྱེད་བྱེད་མ་རེད་བ། སོ་སོ་སོ་སོ་འགན་འཁྱེར་དགོས་རེད། ཨོ་ད་ང་ཉ་རེ་ཉོར་རེ།  ,red ba yod ba/_ya byed myi med ba so so la/_ya byed myi med na e nas so so ga re byed byed ma red ba/_so so so so 'gan 'khyer dgos red/_o da nga nya re nyor re/__,https://d38pmlk0v88drf.cloudfront.net/wav16k/STT_NS_M0028_0391_2933018_to_2940308.wav,STT_NS,3,145,7.29,wav16k/STT_NS_M0028_0391_2933018_to_2940308.wav,རཱ་་ཡ། ཡ་བྱེད་མྱི་མེད་བ་སོ་སོ་ལ། ཡ་བྱེད་མྱི་མེད་ན་ཨེ་ནས་སོ་སོ་ག་རེ་བྱེད་བྱེད་མ་རཱེ། སོ་སོ་སོ་སོ་འགན་འཁྱེར་དགོས་རེད། ཨོ་ད་ང་ཉར་ཡ་ཉོ་རེད།
STT_NS_M0028_0402_3032732_to_3042385,འདི་མེད་བ་བཟོས་ཡ་གི་ཐབས་ཤེས། སོ་སོ་ཆེད་དུ་བྱེད་ཡ་རེད་མ་ཤས། ཨོ་ད་ཝེ། བཀྲ་ཤིས་དབྱངས་ཅན། ང་གཤིས་ཀ་སྡུག་ཆགས་མེད་བ་ཁྱོད་ཆེད་དུ་བཟོས་ཀི་ཡོད་ད་འདྲ་བོ་ཡོད་མ་རེད་ད། སོ་སོ་རང་།  ,'di med ba bzos ya gi thabs shes/_so so ched du byed ya red ma shas/_o da we/_bkra shis dbyangs can/_nga gshis ka sdug chags med ba khyod ched du bzos ki yod da 'dra bo yod ma red da/_so so rang /__,https://d38pmlk0v88drf.cloudfront.net/wav16k/STT_NS_M0028_0402_3032732_to_3042385.wav,STT_NS,3,168,9.653,wav16k/STT_NS_M0028_0402_3032732_to_3042385.wav,འདི་མེད་བ་བཟོ་ཡ་གི་ཐབས་ཤེས། སོ་སོའི་ཆེད་དུ་བྱེད་ཡ་རེད་མ་གཤི། ཨོ་ད་ཝེ་བཀྲ་ཤིས་དབྱངས་ཅན། ང་གཤིས་ཀ་སྡུག་ཅག་མེད་བ་ཁྱོད་ཆེད་དུ་བཟོ་གི་ཡོད་ད་འདྲ་བོ་ཡོད་མ་རེད་ད། སོ་སོ་རང་ཡར།
STT_NS_M0028_0403_3042385_to_3052037,ཡར་རྒྱས་འགྲོ་ཡ་ཆེད་དུ་ཡོད་བ། གཤིས་ཀ་སྡུག་ཆགས་ག་རེ་ཡོད་བ་ཡིན་ནས། སོ་སོ་ག་རེ་མཐོང་གི་འདུག ཡིན་ཅིག་མིན་ཅིག་མིས་ལབ་དགོས་མ་རེད་བ། ཁྱོད་ཁྱོད་རྟག་པར་ཞོགས་པས་ཉལ་བསྡད་ཀྱི་འདུག་ག ཨོ་འདི་ཡག་པོ་མ་རེད་ཨེ་འདྲའི་འདྲ་བོ། ཆུང་ཆུང་མ་རེད་བ་ད་ང་ཚོ་ཚང་མ།  ,yar rgyas 'gro ya ched du yod ba/_gshis ka sdug chags ga re yod ba yin nas/_so so ga re mthong gi 'dug_yin cig min cig mis lab dgos ma red ba/_khyod khyod rtag par zhogs pas nyal bsdad kyi 'dug ga_o 'di yag po ma red e 'dra'i 'dra bo/_chung chung ma red ba da nga tsho tshang ma/__,https://d38pmlk0v88drf.cloudfront.net/wav16k/STT_NS_M0028_0403_3042385_to_3052037.wav,STT_NS,3,235,9.652,wav16k/STT_NS_M0028_0403_3042385_to_3052037.wav,ར་རྒྱས་འགྲོ་ཡ་ཆེད་དུ་ཡོད་བ། གཤིས་ཀ་སྡུག་ཅག་ག་རེ་ཡོད་བ་ཡིན་ན་སོ་སོ་ག་རེ་མཐོང་གི་འདུག ཡིན་གཅིག་མིན་གཅིག་མིས་ལབ་དགོས་མ་རཱེ། ཁྱོད་ཁྱོད་རྟག་པར་ཞོགས་ཀ་ཉར་བསྡད་ཀི་འདུག་ག། འོ་དེ་ཡག་པོ་མ་རེད། ཨེ་འདྲའི་འདྲ་བོ་ཆུང་ཆུང་མ་རཱེ་ད་ང་ཚོ་ཚང་མ།
STT_NS_M0028_0404_3053033_to_3062736,སོ་སོ་མགོ་ཚོད་བ་བྱེད་ཡ་རེད། ང་ཉལ་བསྡད་ནས་ག་རེ་རག་གི་འདུག་ལབ་ཡ་ཅིག་ཡོད་བ། འདི་ལས་ད་ང་དགོང་དག་རྟག་པར་ཉལ་བ་ཡིན་ན། ཞོགས་ཀའི་ང་འཛིན་གྲྭ་ཡེ་འགྲོ་ཡ་རག་གི་རེད། ཁ་ལག་ཡེ་རག་གི་རེད་ལབ་ཡ་ཅིག་ཡོད་བ། ཞོགས་ཇ་ཡེ་རག་གི་རེད་ལབ་ནས། ཨོ་འདི་བསམ་བློ་བཏང་ནས།  ,so so mgo tshod ba byed ya red/_nga nyal bsdad nas ga re rag gi 'dug lab ya cig yod ba/_'di las da nga dgong dag rtag par nyal ba yin na/_zhogs ka'i nga 'dzin grwa ye 'gro ya rag gi red/_kha lag ye rag gi red lab ya cig yod ba/_zhogs ja ye rag gi red lab nas/_o 'di bsam blo btang nas/__,https://d38pmlk0v88drf.cloudfront.net/wav16k/STT_NS_M0028_0404_3053033_to_3062736.wav,STT_NS,3,237,9.703,wav16k/STT_NS_M0028_0404_3053033_to_3062736.wav,སོ་སོ་མགོ་འཚོས་པ་བྱེད་ཡ་རེད། ང་ཉལ་བསྡད་ནས་ག་རེ་རག་གི་འདུག་ལབ་ཡ་ཅིག་ཡོད་བ། དེ་ལས་ད་ང་དགོང་དག་ཏག་ཏག་ཉལ་བ་ཡིན་ན་ཞོགས་ཀ་ང་འཛིན་གྲྭ་ཡང་འགྲོ་ཡ་རག་ག། ཁ་ལག་ཡང་རག་གི་རེད་ལབ་ཡ་ཅིག་ཡོད་བ། ཞོགས་ཇ་ཡང་རག་གི་རེད་ལབ་ི། ཨོ་འདི་བསམ་བློ་བཏང་ནས།
STT_TT00072_06353.800-06361.500,ད། རིང་བསྲེལ་བླུག་སའི་བུམ་པ་ཅིག་ཡོད་རེད་བ། རིང་བསྲེལ་བླུག་སའི་བུམ་པ་དེ། ག་བར་ཡོད་རེད་ཟེར་ན། ད་ལྟ་ཀ་ལི་ཀ་ཏའི་འགྲོན། འགྲེམ་སྟོན་ཁང་ནང་ལ། བཞག་བཞག་ཡོད་རེད་ཟེ།  ,da/_ring bsrel blug sa'i bum pa cig yod red ba/_ring bsrel blug sa'i bum pa de/_ga bar yod red zer na/_da lta ka li ka ta'i 'gron/_'grem ston khang nang la/_bzhag bzhag yod red ze/__,https://d38pmlk0v88drf.cloudfront.net/wav16k/STT_TT00072_06353.800-06361.500.wav,STT_TT,3,156,7.699999999999818,wav16k/STT_TT00072_06353.800-06361.500.wav,ད་ རིང་སྲེལ་བླུག་སའི་བུམ་པ་ཅིག་ཡོད་རེད་བ། རིང་སྲེལ་བླུག་སའི་བུམ་པ་དེ་ག་བ་ཡོད་རེད་ཟེར་ན། ད་ལྟ་ཀ་ལི་ཀ་ཏེ་འགྲོམ། འགྲེམ་སྟོན་ཁང་ནང་ལ་ཕྱིན། བཞག་བཞག་ཡོད་རེད་ཟེ།
STT_TT00072_06362.200-06364.450,ད་བུམ་པའི་ནང་གི། ཅ་ལག་དེ་ཚོ་ཚང་མ་ལོ།  ,da bum pa'i nang gi/_ca lag de tsho tshang ma lo/__,https://d38pmlk0v88drf.cloudfront.net/wav16k/STT_TT00072_06362.200-06364.450.wav,STT_TT,3,38,2.25,wav16k/STT_TT00072_06362.200-06364.450.wav,ད་བུམ་པའི་ནང་གི། ཅ་ལག་དེ་ཚོ་ཚང་མ་ལོ་
STT_NS_M0028_0405_3062736_to_3072439,སོ་སོ་སོ་སོ་ག་རེ་ཕན་གི་འདུག་རཱ། སོ་སོ་གཟུགས་པོ་ལ་ག་རེ་དགོས་འདུག ཨོ་འདི་བསམ་བློ་བཏང་དགོས་རེད་ཟེ། ཨོ་ད་ང་ཚོ་ཨེ་འདྲས་བལྟ་རེད་བ། ང་ཚོ་ཀ་ཅི་མི་ཚེ་ནང་ལོགས་ལ་གཙང་སྦྲ་ལབ་ཡ་འདི།  ,so so so so ga re phan gi 'dug rA/_so so gzugs po la ga re dgos 'dug_o 'di bsam blo btang dgos red ze/_o da nga tsho e 'dras blta red ba/_nga tsho ka ci mi tshe nang logs la gtsang sbra lab ya 'di/__,https://d38pmlk0v88drf.cloudfront.net/wav16k/STT_NS_M0028_0405_3062736_to_3072439.wav,STT_NS,3,170,9.703,wav16k/STT_NS_M0028_0405_3062736_to_3072439.wav,སོ་སོ་སོ་སོ་ག་རེ་ཕན་གི་འདུག་རཱ། སོ་སོའ་གཟུགས་པོ་ལ་ག་རེ་དགོས་འདུག ཨོ་དེ་བསམ་བློ་གཏང་དགོས་རེད་ཟེ། ཨོ་ད་ང་ཚོ་ཨེ་འདྲའི་ལྟ་རཱ། ང་ཚོ་ཀ་ཅི་མི་ཚེའི་ནང་ལོགས་ལ་གཙང་སྦྲ་ལབ་ཡ་དེ།
STT_NS_M0028_0406_3072439_to_3082142,ཡ་ཡུད་གལ་ཆེན་པོ་རེད་འདུག་བ་གཙང་སྦྲ་འདྲ་བོ་ད། གཙང་སྦྲ་བྱེད་ཡ་འདྲ་བོ་དང་། ཨེ་ནས་སོ་སོ་གཙངསྦྲ་བྱེད་ཡ་འདི་ད། མི་ཚང་མ་ག་རེ་ཆེད་དུ་བྱེད་ཀི་ཡོད་རེད། སོ་སོ་ཆེད་དུ་བྱེད་ཀི་ཡོད་རེད་བ་ད། སོ་སོ་ཆེད་དུ་ད་འདི་གམ།  ,ya yud gal chen po red 'dug ba gtsang sbra 'dra bo da/_gtsang sbra byed ya 'dra bo dang /_e nas so so gtsangasbra byed ya 'di da/_mi tshang ma ga re ched du byed ki yod red/_so so ched du byed ki yod red ba da/_so so ched du da 'di gam/__,https://d38pmlk0v88drf.cloudfront.net/wav16k/STT_NS_M0028_0406_3072439_to_3082142.wav,STT_NS,3,200,9.703,wav16k/STT_NS_M0028_0406_3072439_to_3082142.wav,ཡ་ཡུད་གལ་ཆེན་པོ་རེད་འདུག་བ། གཙང་སྦྲ་འདྲ་བོ་དང་། གཙང་སྦྲ་བྱེད་ཡ་འདྲ་བོ་དང་། ཨེ་ནས་སོ་སོ་ོ་གཙང་སྦྲ་བྱེད་ཡ་དེ་ད་མི་ཚང་མ་ག་རེ་བྱས་ནས་བྱེད་ཀི་ཡོད་རེད། སོ་སོའི་ཆེད་དུ་བྱེད་ཀི་ཡོད་རེད་ད། སོ་སོའི་ཆེད་དུ་ད
STT_NS_M0028_0407_3082142_to_3091845,འདི་གམ་ཙི་བྱེད་ཐུབ་ཡ་འདི་ད་སོ་སོ་ཀ་ཅི་ལས་འགན་འདྲ་བོ་རཱ། གཙང་སྦྲ་བྱེད་ཡ་འདི་ཚོ་ཡོད་བ། སློབ་སྦྱོང་བྱེད་ཡ་འདི་ཚོ་སོ་སོ་ལས་འགན་འདྲ་བོ་རཱ། སོ་སོ་ལ་མ་ཤས་ད་ཕན་ཐོགས་ཡ་ཡོད་མ་རེད་བ། ད་གཙང་སྦྲ་འདྲ་བོ་བྱས་ན།  ,'di gam tsi byed thub ya 'di da so so ka ci las 'gan 'dra bo rA/_gtsang sbra byed ya 'di tsho yod ba/_slob sbyong byed ya 'di tsho so so las 'gan 'dra bo rA/_so so la ma shas da phan thogs ya yod ma red ba/_da gtsang sbra 'dra bo byas na/__,https://d38pmlk0v88drf.cloudfront.net/wav16k/STT_NS_M0028_0407_3082142_to_3091845.wav,STT_NS,3,197,9.703,wav16k/STT_NS_M0028_0407_3082142_to_3091845.wav,དགམ་ཙི་བྱེད་ཐུབ་ཡ་དེ་ད་སོ་སོ་ཀ་ཅི་ལས་འགན་འདྲ་བོ་རཱ། གཙང་སྦྲ་བྱེད་ཡ་དེ་ཚོ་ཡོད་བ། སློབ་སྦྱོང་བྱེད་ཡ་དེ་ཚོ་སོ་སོའ་ལས་འགན་འདྲ་བོ་རཱ། སོ་སོ་ལ་མ་གཞི་ཕན་ཐོགས་ཡ་འདྲ་བོ་ཡོད་མ་རཱེ། ད་གཙང་སྦྲ་འདྲ་བོ་བྱས་ན།
